{
  "$schema": "./sitemap.schema.json",
  "dimensions": {
    "width": 18,
    "height": 12,
    "unit": "meters"
  },
  "walls": [
    {
      "id": "wall-top",
      "start": { "x": 0, "y": 12 },
      "end": { "x": 18, "y": 12 },
      "type": "external"
    },
    {
      "id": "wall-right",
      "start": { "x": 18, "y": 12 },
      "end": { "x": 18, "y": 0 },
      "type": "external"
    },
    {
      "id": "wall-bottom",
      "start": { "x": 18, "y": 0 },
      "end": { "x": 0, "y": 0 },
      "type": "external"
    },
    {
      "id": "wall-left",
      "start": { "x": 0, "y": 0 },
      "end": { "x": 0, "y": 12 },
      "type": "external"
    }
  ],
  "cameras": [
    {
      "id": "camera1",
      "name": "HC3 (Auditorium)",
      "model": "AXIS P3245-LVE",
      "rtspUrl": "rtsp://localhost:8554/camera1",
      "webrtcUrl": "http://localhost:9101",
      "ipAddress": "192.168.1.101",
      "position": { "x": 16.22, "y": 11.7 },
      "azimuth": 198,
      "elevation": 1,
      "height": 1.68,
      "fieldOfView": 66,
      "resolution": { "width": 1920, "height": 1080 },
      "distortion": { "k1": 0, "k2": 0, "p1": 0, "p2": 0 },
      "color": "cyan-500"
    },
    {
      "id": "camera2",
      "name": "HC4 (Auditorium)",
      "model": "AXIS P3245-LVE",
      "rtspUrl": "rtsp://localhost:8554/camera2",
      "webrtcUrl": "http://localhost:9102",
      "ipAddress": "192.168.1.102",
      "position": { "x": 0.9, "y": 11.5 },
      "azimuth": 133,
      "elevation": -5,
      "height": 1.67,
      "fieldOfView": 60,
      "resolution": { "width": 1920, "height": 1080 },
      "distortion": { "k1": 0, "k2": 0, "p1": 0, "p2": 0 },
      "color": "amber-500"
    }
  ],
  "obstacles": [
    {
      "id": "pillar-1",
      "type": "circle",
      "label": "Pillar 1",
      "category": "structural",
      "position": { "x": 6, "y": 3 },
      "radius": 0.25,
      "height": 3.0,
      "blocksTracking": true,
      "blocksView": true,
      "color": "#e2e8f0"
    },
    {
      "id": "pillar-2",
      "type": "circle",
      "label": "Pillar 2",
      "category": "structural",
      "position": { "x": 12, "y": 3 },
      "radius": 0.25,
      "height": 3.0,
      "blocksTracking": true,
      "blocksView": true,
      "color": "#e2e8f0"
    },
    {
      "id": "pillar-3",
      "type": "circle",
      "label": "Pillar 3",
      "category": "structural",
      "position": { "x": 6, "y": 9 },
      "radius": 0.25,
      "height": 3.0,
      "blocksTracking": true,
      "blocksView": true,
      "color": "#e2e8f0"
    },
    {
      "id": "pillar-4",
      "type": "circle",
      "label": "Pillar 4",
      "category": "structural",
      "position": { "x": 12, "y": 9 },
      "radius": 0.25,
      "height": 3.0,
      "blocksTracking": true,
      "blocksView": true,
      "color": "#e2e8f0"
    },
    {
      "id": "table-1",
      "type": "rectangle",
      "label": "Registration Table",
      "category": "furniture",
      "position": { "x": 14, "y": 1.8 },
      "dimensions": { "width": 1.0, "height": 0.5 },
      "rotation": 0,
      "height": 1.0,
      "blocksTracking": false,
      "blocksView": true,
      "color": "#f5f5f4"
    }
  ]
}
